<?xml version="1.0" encoding="UTF-8"?>
<xs:schema xmlns:xs="http://www.w3.org/2001/XMLSchema">

  <!-- Define a custom type for positive integers -->
  <xs:simpleType name="PositiveInteger">
    <xs:restriction base="xs:integer">
      <!-- Custom restriction: Floor must be a positive integer -->
      <xs:minInclusive value="1" />
    </xs:restriction>
  </xs:simpleType>

  <!-- Root element -->
  <xs:element name="healthcareData">
    <xs:complexType>
      <xs:sequence>
        <xs:element ref="providerRecord" maxOccurs="unbounded" />
      </xs:sequence>
      <xs:attribute name="lang" type="xs:string" use="optional" />
    </xs:complexType>
  </xs:element>

  <!-- providerRecord element -->
  <xs:element name="providerRecord">
    <xs:complexType>
      <xs:sequence>
        <xs:element ref="provIdentifier" />
        <xs:element ref="provName" />
        <xs:element ref="provEstablishmentYear" />
        <xs:element ref="provRating" />
        <xs:element ref="provAddress" />
        <xs:element ref="provContacts" />
        <xs:element ref="provDepartments" />
        <xs:element ref="provServices" />
      </xs:sequence>
      <xs:attribute name="provID" type="xs:string" use="required" />
    </xs:complexType>
  </xs:element>

  <!-- provIdentifier -->
  <xs:element name="provIdentifier" type="xs:string" />

  <!-- provName -->
  <xs:element name="provName" type="xs:string" />

  <!-- provEstablishmentYear with a custom numeric restriction -->
  <xs:element name="provEstablishmentYear">
    <xs:simpleType>
      <xs:restriction base="xs:integer">
        <!-- Custom restriction: Year must be between 1900 and 2025 -->
        <xs:minInclusive value="1900" />
        <xs:maxInclusive value="2025" />
      </xs:restriction>
    </xs:simpleType>
  </xs:element>

  <!-- provRating with a custom decimal restriction -->
  <xs:element name="provRating">
    <xs:simpleType>
      <xs:restriction base="xs:decimal">
        <!-- Custom restriction: Rating must be between 0.0 and 5.0 -->
        <xs:minInclusive value="0.0" />
        <xs:maxInclusive value="5.0" />
      </xs:restriction>
    </xs:simpleType>
  </xs:element>

  <!-- provAddress complex type -->
  <xs:element name="provAddress">
    <xs:complexType>
      <xs:sequence>
        <xs:element name="addrStreet" type="xs:string" />
        <xs:element name="addrCity" type="xs:string" />
        <xs:element name="addrState" type="xs:string" />
        <xs:element name="addrPostal" type="xs:string" />
        <xs:element name="addrCountry" type="xs:string" />
      </xs:sequence>
    </xs:complexType>
  </xs:element>

  <!-- provContacts complex type -->
  <xs:element name="provContacts">
    <xs:complexType>
      <xs:sequence>
        <xs:element name="contactPhone" type="xs:string" />
        <xs:element name="contactEmail">
          <xs:complexType>
            <xs:simpleContent>
              <xs:extension base="xs:string">
                <xs:attribute name="verified" type="xs:string" use="required" />
              </xs:extension>
            </xs:simpleContent>
          </xs:complexType>
        </xs:element>
        <xs:element name="contactWebsite">
          <xs:complexType>
            <xs:simpleContent>
              <xs:extension base="xs:string">
                <xs:attribute name="websiteType" type="xs:string" use="required" />
              </xs:extension>
            </xs:simpleContent>
          </xs:complexType>
        </xs:element>
      </xs:sequence>
    </xs:complexType>
  </xs:element>

  <!-- provDepartments complex type -->
  <xs:element name="provDepartments">
    <xs:complexType>
      <xs:sequence>
        <xs:element ref="deptRecord" maxOccurs="unbounded" />
      </xs:sequence>
    </xs:complexType>
  </xs:element>

  <!-- deptRecord complex type -->
  <xs:element name="deptRecord">
    <xs:complexType>
      <xs:sequence>
        <xs:element name="deptName" type="xs:string" />
        <xs:element name="deptHead" type="xs:string" />
        <xs:element name="deptPhone" type="xs:string" />
        <xs:element name="deptLocation" type="xs:string" />
      </xs:sequence>
      <xs:attribute name="deptID" type="xs:string" use="required" />
      <xs:attribute name="deptFloor" type="PositiveInteger" use="required" />
    </xs:complexType>
  </xs:element>

  <!-- provServices complex type -->
  <xs:element name="provServices">
    <xs:complexType>
      <xs:sequence>
        <xs:element ref="servRecord" maxOccurs="unbounded" />
      </xs:sequence>
    </xs:complexType>
  </xs:element>

  <!-- servRecord complex type -->
  <xs:element name="servRecord">
    <xs:complexType>
      <xs:sequence>
        <xs:element name="servName" type="xs:string" />
        <xs:element name="servDesc" type="xs:string" />
        <xs:element name="servFee">
          <xs:simpleType>
            <!-- Custom restriction: Fee must be a decimal or the literal 'Variable' -->
            <xs:union memberTypes="xs:decimal xs:string">
              <xs:simpleType>
                <xs:restriction base="xs:string">
                  <xs:enumeration value="Variable" />
                </xs:restriction>
              </xs:simpleType>
            </xs:union>
          </xs:simpleType>
        </xs:element>
        <xs:element name="servDuration">
          <xs:simpleType>
            <!-- Custom restriction: Duration must match a pattern like '30 minutes' or '1 hour' -->
            <xs:restriction base="xs:string">
              <xs:pattern value="(\d+ (minutes|hour|hours))" />
            </xs:restriction>
          </xs:simpleType>
        </xs:element>
        <xs:element name="servType" type="xs:string" />
        <xs:element name="servAvailability" type="xs:string" />
      </xs:sequence>
      <xs:attribute name="servID" type="xs:string" use="required" />
      <xs:attribute name="serviceStatus" type="xs:string" use="required" />
    </xs:complexType>
  </xs:element>

</xs:schema>