<?xml version="1.0" encoding="UTF-8"?>
<healthcareData xmlns:xsi="znackovaci" xsi:noNamespaceSchemaLocation="schema.xsd" lang="cs">
    <providerRecord provID="P001">
        <provIdentifier>P001</provIdentifier>
        <provName>Zdravotní středisko Praha 1</provName>
        <provEstablishmentYear establishmentSource="official">1995</provEstablishmentYear>
        <provRating ratingSource="survey">4.5</provRating>
        <provAddress>
            <addrStreet>Vinohradská 123</addrStreet>
            <addrCity>Praha</addrCity>
            <addrState>Praha</addrState>
            <addrPostal>13000</addrPostal>
            <addrCountry>CZ</addrCountry>
        </provAddress>
        <provContacts>
            <contactPhone>+420 222 111 222</contactPhone>
            <contactEmail verified="true">info@zspraha1.cz</contactEmail>
            <contactWebsite websiteType="official">https://zspraha1.cz</contactWebsite>
        </provContacts>
        <provDepartments>
            <deptRecord deptID="D001" deptFloor="1">
                <deptName>Kardiologie</deptName>
                <deptHead>MUDr. Jan Srdce</deptHead>
                <deptPhone>+420 222 111 223</deptPhone>
                <deptLocation>Budova A</deptLocation>
            </deptRecord>
            <deptRecord deptID="D002" deptFloor="2">
                <deptName>Pediatrie</deptName>
                <deptHead>MUDr. Eva Dětská</deptHead>
                <deptPhone>+420 222 111 224</deptPhone>
                <deptLocation>Budova B</deptLocation>
            </deptRecord>
        </provDepartments>
        <provServices>
            <servRecord servID="S001" serviceStatus="active">
                <servName>Všeobecná prohlídka</servName>
                <servDesc>Preventivní zdravotní prohlídka</servDesc>
                <servFee feeCurrency="CZK">500</servFee>
                <servDuration>30 minut</servDuration>
                <servType>Konzultace</servType>
                <servAvailability>Dostupná</servAvailability>
            </servRecord>
            <servRecord servID="S002" serviceStatus="active">
                <servName>Pohotovost</servName>
                <servDesc>Nonstop pohotovostní služba</servDesc>
                <servFee feeCurrency="CZK">Variabilní</servFee>
                <servDuration>Ihned</servDuration>
                <servType>Akutní péče</servType>
                <servAvailability>Vždy</servAvailability>
            </servRecord>
        </provServices>
    </providerRecord>

    <providerRecord provID="P002">
        <provIdentifier>P002</provIdentifier>
        <provName>Zdravotní centrum Brno</provName>
        <provEstablishmentYear establishmentSource="official">2000</provEstablishmentYear>
        <provRating ratingSource="survey">4.2</provRating>
        <provAddress>
            <addrStreet>Masarykova 456</addrStreet>
            <addrCity>Brno</addrCity>
            <addrState>Jihomoravský kraj</addrState>
            <addrPostal>60200</addrPostal>
            <addrCountry>CZ</addrCountry>
        </provAddress>
        <provContacts>
            <contactPhone>+420 533 222 333</contactPhone>
            <contactEmail verified="false">kontakt@zdravbrno.cz</contactEmail>
            <contactWebsite websiteType="official">https://zdravbrno.cz</contactWebsite>
        </provContacts>
        <provDepartments>
            <deptRecord deptID="D003" deptFloor="3">
                <deptName>Ortopedie</deptName>
                <deptHead>MUDr. Petr Kostka</deptHead>
                <deptPhone>+420 533 222 334</deptPhone>
                <deptLocation>Budova C</deptLocation>
            </deptRecord>
        </provDepartments>
        <provServices>
            <servRecord servID="S003" serviceStatus="active">
                <servName>Fyzioterapie</servName>
                <servDesc>Rehabilitační služby</servDesc>
                <servFee feeCurrency="CZK">750</servFee>
                <servDuration>45 minut</servDuration>
                <servType>Terapeutická péče</servType>
                <servAvailability>Dostupná</servAvailability>
            </servRecord>
        </provServices>
    </providerRecord>

    <providerRecord provID="P003">
        <provIdentifier>P003</provIdentifier>
        <provName>Poliklinika Ostrava</provName>
        <provEstablishmentYear establishmentSource="official">2010</provEstablishmentYear>
        <provRating ratingSource="survey">4.8</provRating>
        <provAddress>
            <addrStreet>Nádražní 789</addrStreet>
            <addrCity>Ostrava</addrCity>
            <addrState>Moravskoslezský kraj</addrState>
            <addrPostal>70200</addrPostal>
            <addrCountry>CZ</addrCountry>
        </provAddress>
        <provContacts>
            <contactPhone>+420 596 333 444</contactPhone>
            <contactEmail verified="true">info@poliklinikaostrava.cz</contactEmail>
            <contactWebsite websiteType="official">https://poliklinikaostrava.cz</contactWebsite>
        </provContacts>
        <provDepartments>
            <deptRecord deptID="D004" deptFloor="1">
                <deptName>Neurologie</deptName>
                <deptHead>MUDr. Pavel Mozek</deptHead>
                <deptPhone>+420 596 333 445</deptPhone>
                <deptLocation>Budova D</deptLocation>
            </deptRecord>
        </provDepartments>
        <provServices>
            <servRecord servID="S004" serviceStatus="inactive">
                <servName>Vyšetření magnetickou rezonancí</servName>
                <servDesc>Pokročilé diagnostické zobrazování</servDesc>
                <servFee feeCurrency="CZK">3000</servFee>
                <servDuration>1 hodina</servDuration>
                <servType>Zobrazování</servType>
                <servAvailability>Omezená</servAvailability>
            </servRecord>
        </provServices>
    </providerRecord>

    <providerRecord provID="P004">
        <provIdentifier>P004</provIdentifier>
        <provName>Kožní klinika Plzeň</provName>
        <provEstablishmentYear establishmentSource="official">1985</provEstablishmentYear>
        <provRating ratingSource="survey">4.0</provRating>
        <provAddress>
            <addrStreet>Smetanova 321</addrStreet>
            <addrCity>Plzeň</addrCity>
            <addrState>Plzeňský kraj</addrState>
            <addrPostal>30100</addrPostal>
            <addrCountry>CZ</addrCountry>
        </provAddress>
        <provContacts>
            <contactPhone>+420 377 444 555</contactPhone>
            <contactEmail verified="true">info@koznipraxe.cz</contactEmail>
            <contactWebsite websiteType="official">https://koznipraxe.cz</contactWebsite>
        </provContacts>
        <provDepartments>
            <deptRecord deptID="D005" deptFloor="2">
                <deptName>Dermatologie</deptName>
                <deptHead>MUDr. Lucie Kožní</deptHead>
                <deptPhone>+420 377 444 556</deptPhone>
                <deptLocation>Budova E</deptLocation>
            </deptRecord>
        </provDepartments>
        <provServices>
            <servRecord servID="S005" serviceStatus="active">
                <servName>Léčba kožních onemocnění</servName>
                <servDesc>Pokročilá dermatologická péče</servDesc>
                <servFee feeCurrency="CZK">1200</servFee>
                <servDuration>40 minut</servDuration>
                <servType>Terapeutická péče</servType>
                <servAvailability>Dostupná</servAvailability>
            </servRecord>
        </provServices>
    </providerRecord>
</healthcareData>